{
  "schema_version": 1,
  "canonical_product_name": "Super Dolphin Agent",
  "canonical_repository": "github.com/lihah111222333-cloud/super-dolphin-agent",
  "canonical_module_path": "github.com/lihah111222333-cloud/super-dolphin-agent",
  "license_spdx": "Apache-2.0",
  "required_root_files": [
    "README.md",
    "README.zh-CN.md",
    "README.ja.md",
    "README.ko.md",
    "README.es.md",
    "README.de.md",
    "AGENTS.md",
    "CHANGELOG.md",
    "CODE_OF_CONDUCT.md",
    "CONTRIBUTING.md",
    "LICENSE",
    "NOTICE",
    "SECURITY.md",
    "SUPPORT.md",
    "Makefile",
    "go.mod",
    "go.sum",
    "sqlc.yaml"
  ],
  "allow_rules": [
    {"kind": "file", "pattern": ".ai-project-map.overrides.json"},
    {"kind": "file", "pattern": ".env.example"},
    {"kind": "file", "pattern": ".gitattributes"},
    {"kind": "file", "pattern": ".gitignore"},
    {"kind": "file", "pattern": ".golangci.yml"},
    {"kind": "file", "pattern": ".githooks/README.md"},
    {"kind": "file", "pattern": ".githooks/commit-msg"},
    {"kind": "file", "pattern": ".githooks/pre-commit"},
    {"kind": "file", "pattern": ".githooks/pre-push"},
    {"kind": "file", "pattern": "AGENTS.md"},
    {"kind": "file", "pattern": "CHANGELOG.md"},
    {"kind": "file", "pattern": "CODE_OF_CONDUCT.md"},
    {"kind": "file", "pattern": "CONTRIBUTING.md"},
    {"kind": "file", "pattern": "LICENSE"},
    {"kind": "file", "pattern": "Makefile"},
    {"kind": "file", "pattern": "NOTICE"},
    {"kind": "file", "pattern": "README.de.md"},
    {"kind": "file", "pattern": "README.es.md"},
    {"kind": "file", "pattern": "README.ja.md"},
    {"kind": "file", "pattern": "README.ko.md"},
    {"kind": "file", "pattern": "README.md"},
    {"kind": "file", "pattern": "README.zh-CN.md"},
    {"kind": "file", "pattern": "SECURITY.md"},
    {"kind": "file", "pattern": "SUPPORT.md"},
    {"kind": "file", "pattern": "run-new-ui-desktop.ps1"},
    {"kind": "file", "pattern": "run-new-ui-desktop.sh"},
    {"kind": "file", "pattern": "go.mod"},
    {"kind": "file", "pattern": "go.sum"},
    {"kind": "file", "pattern": "sqlc.yaml"},
    {"kind": "glob", "pattern": ".agents/skills/**"},
    {"kind": "glob", "pattern": ".github/ISSUE_TEMPLATE/**"},
    {"kind": "file", "pattern": ".github/PULL_REQUEST_TEMPLATE.md"},
    {"kind": "file", "pattern": ".github/workflows/open-source-gates.yml"},
    {"kind": "glob", "pattern": "cmd/**"},
    {"kind": "glob", "pattern": "docs/adr/**"},
    {"kind": "glob", "pattern": "docs/decisions/**"},
    {"kind": "glob", "pattern": "docs/demo/**"},
    {"kind": "glob", "pattern": "docs/doc/codemap/**"},
    {"kind": "glob", "pattern": "docs/open-source/**"},
    {"kind": "glob", "pattern": "docs/契约/**"},
    {"kind": "glob", "pattern": "docs/架构/**"},
    {"kind": "glob", "pattern": "examples/**"},
    {"kind": "glob", "pattern": "frontend-app/**"},
    {"kind": "glob", "pattern": "internal/**"},
    {"kind": "glob", "pattern": "pkg/**"},
    {"kind": "glob", "pattern": "release/**"},
    {"kind": "glob", "pattern": "scripts/**"},
    {"kind": "glob", "pattern": "sql/**"},
    {"kind": "glob", "pattern": "third_party/**"}
  ],
  "deny_rules": [
    {"kind": "glob", "pattern": ".agent/**"},
    {"kind": "glob", "pattern": ".agnet/**"},
    {"kind": "glob", "pattern": ".codex/**"},
    {"kind": "glob", "pattern": ".workspace/**"},
    {"kind": "glob", "pattern": ".worktrees/**"},
    {"kind": "glob", "pattern": "docs/archive/**"},
    {"kind": "glob", "pattern": "docs/before/**"},
    {"kind": "glob", "pattern": "docs/cc/**"},
    {"kind": "glob", "pattern": "docs/plans/**"},
    {"kind": "glob", "pattern": "docs/superpowers/specs/**"},
    {"kind": "file", "pattern": "docs/doc/codemap/ai-index.json"},
    {"kind": "glob", "pattern": "docs/doc/codemap/project-map/**"},
    {"kind": "file", "pattern": "docs/doc/codemap/capability-contract/capability_manifest.json"}
  ],
  "forbidden_identities": [
    "/Users/",
    "Anthropic, Inc.",
    "Proprietary",
    "Super Agent v3",
    "github.com/anthropic-ai/super-agent-v3",
    "github.com/lihah111222333-cloud/Super-Dolphin"
  ],
  "required_readmes": [
    "README.md",
    "README.zh-CN.md",
    "README.ja.md",
    "README.ko.md",
    "README.es.md",
    "README.de.md"
  ],
  "required_readme_sections": [
    "sd:why",
    "sd:architecture",
    "sd:quick-start",
    "sd:governance-demo",
    "sd:security",
    "sd:community"
  ],
  "forbidden_file_names": [
    ".DS_Store",
    ".env",
    ".mcp.json",
    "*.db",
    "*.db-shm",
    "*.db-wal",
    "*.log",
    "*.xls",
    "*.zip",
    "CLAUDE.md",
    "GEMINI.md"
  ],
  "generated_files": [
    "docs/doc/codemap/ai-index.json",
    "docs/doc/codemap/capability-contract/capability_manifest.json",
    "docs/doc/codemap/project-map/AI_PROJECT_DRIFT.md",
    "docs/doc/codemap/project-map/AI_PROJECT_MANIFEST.json",
    "docs/doc/codemap/project-map/AI_PROJECT_MAP.md",
    "docs/doc/codemap/project-map/index/app-ui.tsv",
    "docs/doc/codemap/project-map/index/docs-agent.tsv",
    "docs/doc/codemap/project-map/index/modules.tsv",
    "docs/doc/codemap/project-map/index/orchestration.tsv",
    "docs/doc/codemap/project-map/index/other.tsv",
    "docs/doc/codemap/project-map/index/platform-provider.tsv",
    "docs/doc/codemap/project-map/index/store-sql.tsv"
  ]
}
